{
  "schema_version": 1,
  "profile_id": "prof_home",
  "name": "家里集群",
  "cluster_id": "cluster_7f3a",
  "master_endpoint": {
    "scheme": "http",
    "host": "100.64.0.1",
    "port": 8888
  },
  "status": "active",
  "key_ref": "qlh:cluster_7f3a:secret",
  "node_role": "client",
  "last_verified_at": "2026-08-06T11:00:00Z",
  "created_at": "2026-08-06T10:00:00Z"
}
